<!ELEMENT pedidos (anio)>
<!ELEMENT anio (trimestre)>
<!ATTLIST anio
          year CDATA #REQUIRED>
<!ELEMENT trimestre (pedido+)>
<!ATTLIST trimestre
          num CDATA #REQUIRED>
<!ELEMENT pedido (cliente, fecha_inclusion, detalle_pedido)>
<!ELEMENT cliente (nombre, apellidos, telefono, direccion, correo)>
<!ELEMENT nombre (#PCDATA)>
<!ELEMENT apellidos (#PCDATA)>
<!ELEMENT telefono (#PCDATA)>
<!ELEMENT direccion (calle, ciudad, codigo_postal, provincia)>
<!ELEMENT calle (#PCDATA)>
<!ELEMENT ciudad (#PCDATA)>
<!ELEMENT codigo_postal (#PCDATA)>
<!ELEMENT provincia (#PCDATA)>
<!ELEMENT correo (#PCDATA)>
<!ELEMENT fecha_inclusion (#PCDATA)>
<!ELEMENT detalle_pedido (numero_pedido, fecha_compra, fecha_entrega, total_factura, productos)>
<!ELEMENT numero_pedido (#PCDATA)>
<!ELEMENT fecha_compra (#PCDATA)>
<!ELEMENT fecha_entrega (#PCDATA)>
<!ELEMENT total_factura (#PCDATA)>
<!ELEMENT productos (producto+)>
<!ELEMENT producto (nombre, referencia, precio, unidades)>
<!ELEMENT referencia (#PCDATA)>
<!ELEMENT precio (#PCDATA)>
<!ELEMENT unidades (#PCDATA)>
